{
  "id": "numbers",
  "title": "Numbers 1-10",
  "description": "Basic counting in Chinese",
  "content": "一、二、三、四、五、六、七、八、九、十。我有三本书。",
  "metadata": {
    "difficulty": "beginner",
    "tags": ["numbers", "counting", "basic", "math"],
    "characterCount": 30,
    "source": "PinyinMate Sample Content",
    "book": null,
    "vocabulary": [
      {
        "word": "一",
        "definition": "one"
      },
      {
        "word": "二",
        "definition": "two"
      },
      {
        "word": "三",
        "definition": "three"
      },
      {
        "word": "四",
        "definition": "four"
      },
      {
        "word": "五",
        "definition": "five"
      },
      {
        "word": "六",
        "definition": "six"
      },
      {
        "word": "七",
        "definition": "seven"
      },
      {
        "word": "八",
        "definition": "eight"
      },
      {
        "word": "九",
        "definition": "nine"
      },
      {
        "word": "十",
        "definition": "ten"
      },
      {
        "word": "本",
        "definition": "classifier for books"
      },
      {
        "word": "书",
        "definition": "book"
      }
    ],
    "grammarPoints": [
      "Basic numbers 1-10",
      "Using classifiers with numbers: 三本书 (three books)",
      "Numbers as adjectives before nouns"
    ],
    "culturalNotes": [
      "The number 4 is considered unlucky because it sounds like 'death' (死)",
      "The number 8 is considered very lucky in Chinese culture",
      "Classifiers (measure words) are always used between numbers and nouns"
    ],
    "estimatedTime": 10,
    "createdAt": "2025-09-29T12:00:00Z",
    "updatedAt": "2025-09-29T12:00:00Z"
  }
}